<?xml version="1.0" encoding="UTF-8" ?>
<!DOCTYPE Persons SYSTEM "ad.dtd">
<Persons>
    <Person>
        <Email>
            ivanov@mail.ru
        </Email>
        <Nickname>
            Ivan1988
        </Nickname>
        <Password>
            01011988
        </Password>
        <Ads>
            <Ad>
                <Description>
                    Очень хорошая квартира.
                </Description>
                <Adress>
                    ул. В. Хоружей д. 13 кв. 12
                </Adress>
                <Floor>
                    23
                </Floor>
                <Floors>
                    25
                </Floors>
                <Square>
                    79.0
                </Square>
            </Ad>
            <Ad>
                <Description>
                    Хорошая квартира.
                </Description>
                <Adress>
                    ул. В. Хоружей д. 11 кв. 12
                </Adress>
                <Floor>
                    3
                </Floor>
                <Floors>
                    5
                </Floors>
                <Square>
                    33.0
                </Square>
            </Ad>
        </Ads>
    </Person>
</Persons>